<!ELEMENT students (student+)>

<!ELEMENT student (rollno, name, email, department)>

<!ELEMENT rollno (#PCDATA)>

<!ELEMENT name (#PCDATA)>

<!ELEMENT email (#PCDATA)>

<!ELEMENT department (CSE | ECE | ME)>

<!ELEMENT CSE (#PCDATA)>
<!ELEMENT ECE (#PCDATA)>
<!ELEMENT ME (#PCDATA)>
